{
  "id": "bren_korda",
  "name": "Bren Korda",
  "role": "Director of Protective Services for the Shedu Maad Memorial Foundation; old GAG security lieutenant in respectable clothing. Smooth with superiors, polite in public, cruel through process. Talon knew him during GAG and disliked him. Killed/discarded by Tess as the public fall guy at PP2 (Ch 20).",
  "age": "",
  "force_status": "",
  "three_dimensions": {
    "surface": "Korda is old GAG security system in a clean suit. He publicly protects grieving families and Foundation events. Privately, he coordinates restricted access, cleanup routes, deniable contractors, and security layers.",
    "backstory_inner_demons": "Being made expendable by people above him. He believes in hierarchy and procedure because both let him pass guilt downward and usefulness upward.",
    "action_under_pressure": "Hides threats inside procedure. Uses proper channels as weapons. Makes others seem unreasonable for noticing danger. Treats compassion as a security vulnerability. Authority lines, leverage, exits, cameras, who can be blamed, who needs permission. Korda should not feel like a thug. He is more frightening when he makes cruelty sound appropriate."
  },
  "voice_notes": "Clean, controlled, administrative menace.\n\nGood Korda: “You are welcome to file a complaint. I can recommend the appropriate office.” “This is a memorial facility, Master Skywalker. I would ask you to remember where you are.” “Security is mostly preventing emotional people from making permanent decisions.” “Veyr. I assumed they had better locks.” Avoid Korda saying: “I am corrupt but respectable.” Better: “Procedure exists to protect everyone. Even people who find it inconvenient.”\n\nThin, superior, procedural. If he jokes, it is to belittle or delay.\n\nSmooth with superiors, polite in public, cruel through process, never openly messy when witnesses matter.\n\nKorda should not feel like a thug. He is more frightening when he makes cruelty sound appropriate.",
  "arc_type": "steadfast",
  "thematic_role": "Director of Protective Services for the Shedu Maad Memorial Foundation; old GAG security lieutenant in respectable clothing. Smooth with superiors, polite in public, cruel through process. Talon knew him during GAG and disliked him. Killed/discarded by Tess as the public fall guy at PP2 (Ch 20).",
  "avoid_list": [
    "Do not write theme as thesis.",
    "Do not make dialogue interchangeable with other cast members."
  ]
}
